id,User,Date,Tweet
416,officialABAT,2019-02-17 00:11:35+00:00,11.We must take INEC’s statement at face value and hold to the belief that INEC understands even more than ever the sober and grave responsibility it has to our nation and our democracy. INEC can only properly discharge that responsibility by conducting free and fair elections.
417,officialABAT,2019-02-17 00:11:34+00:00,"10.What you had set your mind to do on February 16, keep your mind and heart on for February 23. ""INEC has stated the reason for the delay and has expressed regret over the inconveniences it has caused."
418,officialABAT,2019-02-17 00:11:34+00:00,"9.Thus, we appeal to all who actually came out to vote and to those who intended to vote today, to maintain your commitment. Do not allow this delay to deter you from the expression of your democratic rights."
419,officialABAT,2019-02-17 00:11:34+00:00,"8...seek to build and perfect our democracy. For each voter is in part an architect and each one of your votes is a brick by which, when lain together, shall construct a strong democracy in such a way that it shall forever stand and endure."
420,officialABAT,2019-02-17 00:11:33+00:00,"7.This should not have happened for it could well discourage people from coming out when the election takes place. Thus, we heartily commend those people for coming out in exercise of their fundamental rights and duties as citizen voters, who vote by vote..."
421,officialABAT,2019-02-17 00:11:33+00:00,6.We have reports of eager voters rising early to leave their homes to cast their ballots only to be told upon arriving at their appointed polling stations that the election had been postponed.
422,officialABAT,2019-02-17 00:11:32+00:00,"5.This could have perhaps lessened the pervasive disappointment that we all now feel. It also would have helped people better order their steps today."""
423,officialABAT,2019-02-17 00:11:32+00:00,4.We are also perplexed that INEC literally waited so late in the day to make known the obstacles preventing it from keeping faith to the election schedule. INEC could have and should have given the nation more ample and earlier warning.
424,officialABAT,2019-02-17 00:11:32+00:00,"3.""While we appreciate the enormity of the logistical challenge that elections in a vast nation like ours poses to INEC, we are still pained that the Commission could not meet this challenge within the time allotted."
425,officialABAT,2019-02-17 00:11:31+00:00,"2.According to INEC, the one-week postponement of the election from February 16 to February 23 was compelled by logistical difficulties encountered by the commission in transporting essential election material to polling in various parts of the country."
426,officialABAT,2019-02-17 00:11:31+00:00,"1.""As the National Leader of the All Progressives Congress and simply as a Nigerian, I must express my profound concern and dissatisfaction with the unexpected, late hour postponement of the presidential and national assembly elections by INEC."
427,officialABAT,2019-02-17 00:11:30+00:00,"Poll Postponement Painful, But Nigerians Must Maintain Their Commitment"
428,officialABAT,2019-02-14 16:47:50+00:00,"38. For this is as Nigeria and our democratic exercise must be to achieve the excellent destination intended for us.  

SIGNED
Asiwaju Bola Tinubu
February 14, 2019"
429,officialABAT,2019-02-14 16:47:50+00:00,"37. No matter our political differences, let us remember we are of one land and of the same national family. This election shall be free and fair and conducted without the arm of violence."
430,officialABAT,2019-02-14 16:47:49+00:00,"36. 5. SOCIAL SECURITY:
In the spirit of the social programs inaugurated during the president’s first term, I fully support efforts during his second term toward establishing a government-run social security system for the elderly."
431,officialABAT,2019-02-14 16:47:49+00:00,"35. 5. HOUSING:
To provide adequate housing for more people, government should integrate under one roof the numerous residential housing and mortgage programs now existing."
432,officialABAT,2019-02-14 16:47:49+00:00,"34. 4. AGRICULTURE:
I believe the government will work with the states and private sector to develop low-tech but efficient irrigation systems to reclaim more land for cultivation."
433,officialABAT,2019-02-14 16:47:48+00:00,"33. To increase our GDP and wisely position the economy for the future, we must increase the percentage that manufacturing contributes to that GDP."
434,officialABAT,2019-02-14 16:47:48+00:00,"32. 3. INDUSTRIALIZATION:
A national industrial plan aimed at bringing labour-intensive light industries to our cities to provide meaningful employment for our growing urban population should be implemented."
435,officialABAT,2019-02-14 16:47:48+00:00,"31. 2. INFRASTRUCTURE:
Government should put a national infrastructural plan into action. First, we must commit ourselves to a national highway system linking our major cities and towns, our centres of commerce, with each othe."
436,officialABAT,2019-02-14 16:47:47+00:00,"30.I believe the second Buhari administration will work to increase electricity generation, transmission and distribution by 5000 MW within the next 4 years."
437,officialABAT,2019-02-14 16:47:47+00:00,"29. 1. POWER: 
We have made more progress in this area in 4 years than the PDP did in 16. Still, our work remains unfulfilled until we can bring light to all Nigerians when they need it, at costs they can well afford."
438,officialABAT,2019-02-14 16:38:43+00:00,"28.Unlike the PDP, we, the APC, are anchored to the proposition that every Nigerian is entitled to equal access and sufficient opportunity so that he may use his talents, skills and committed exertion to carve for himself and loved ones, decent and good life every human seeks."
439,officialABAT,2019-02-14 16:38:43+00:00,"https://t.co/UOq5JTAg5g this, the PDP is involved neck-deep in the greatest political swindle of this generation. Their real slogan should be “more for the rich, nothing for the rest!”"
440,officialABAT,2019-02-14 16:38:43+00:00,"26.They seek an unfair, unjust and unequal Nigeria. Their definition of Nigeria is a nation run by the greedy, for the profit of the rich, at the command of the mighty."
441,officialABAT,2019-02-14 16:38:42+00:00,"25.Essentially, the PDP seeks an economy that provides the welfare of riches to the powerful while telling the average man that there is not enough money to go around to build an economy that will ensure he can take care of his basic needs."
442,officialABAT,2019-02-14 16:28:46+00:00,"https://t.co/AR44pvu7fP friend observed that if you make a deal with President Buhari, you can always be sure of his intention to follow through. Do the same with Atiku, he said, and prepare yourself for disappointment."
443,officialABAT,2019-02-14 16:28:46+00:00,https://t.co/Tcvep9kN1C I must relate a comment a friend recently made that shows the wide difference between the two parties and their presidential candidates.
444,officialABAT,2019-02-14 16:28:45+00:00,"22.I want no part of such enrichment for my love of Nigeria and its people is far greater and deeper than my friendship with Atiku. For the good of Nigeria and even the good of Atiku himself, we do well to send him into retirement on Saturday."
445,officialABAT,2019-02-14 16:28:45+00:00,"21.Despite our friendship, I must say the type of enrichment of friends he envisions does not recommend itself to me. It is unjust and impoverishes all but a handful of Nigerians."
446,officialABAT,2019-02-14 16:28:45+00:00,"20.Look, I have made no attempts to hide my friendship with Atiku. We were friends before this election and hopefully we will be friends after February 16 when he goes into retirement."
447,officialABAT,2019-02-14 16:28:44+00:00,19.But Atiku goes in the opposite direction. He bypasses patronage to brazenly elevate the much greater evil of cronyism from the shadows to make it the central plank of his national economic policy.
448,officialABAT,2019-02-14 16:28:44+00:00,"18.Just a few weeks ago, Atiku offered his vision of the economy when he said that enriching his friends would be an appropriate objective of any government he led. At best, patronage is a regrettable and necessary reality of politics that should be severely curtailed."
449,officialABAT,2019-02-14 16:28:44+00:00,"https://t.co/QpXSbyVDWM’s boss was reveling that he would further enrich already wealthy cronies. Obi was completely wrong that the nation does not have nations must overcome, I cannot find much good in the policies and programs announced by the PDP."
450,officialABAT,2019-02-14 16:28:43+00:00,"https://t.co/N96J5UiWmq’s rationale was that the nation could not afford to offer even this modest safety net. While in Obi’s eyes a nation possessed of the abundant material wealth of Nigeria could ill afford to give its poorest citizens enough naira merely to survive,"
451,officialABAT,2019-02-14 16:28:43+00:00,15.Atiku’s Chief Economic Advisor Chike Obi intimated a strong preference to discontinue the social welfare payments the Buhari government established for the poorest of the nation’s poor.
452,officialABAT,2019-02-14 16:28:42+00:00,"14.Atiku is not alone in his disregard for the common man. Such disregard is the true brand name of the PDP and its powerful, rich allies. Several weeks ago during a television interview,"
453,officialABAT,2019-02-14 16:28:42+00:00,"https://t.co/Svl9GRDi4Z friend observed that if you make a deal with President Buhari, you can always be sure of his intention to follow through. Do the same with Atiku, he said, and prepare yourself for disappointment."
454,officialABAT,2019-02-14 16:28:42+00:00,https://t.co/jnVIde4OB2 I must relate a comment a friend recently made that shows the wide difference between the two parties and their presidential candidates.
455,officialABAT,2019-02-14 16:28:41+00:00,"11. I want no part of such enrichment for my love of Nigeria and its people is far greater and deeper than my friendship with Atiku. For the good of Nigeria and even the good of Atiku himself, we do well to send him into retirement on Saturday."
456,officialABAT,2019-02-14 16:28:41+00:00,"10.Despite our friendship, I must say the type of enrichment of friends he envisions does not recommend itself to me. It is unjust and impoverishes all but a handful of Nigerians."
457,officialABAT,2019-02-14 16:28:41+00:00,"9.Look, I have made no attempts to hide my friendship with Atiku. We were friends before this election and hopefully we will be friends after February 16 when he goes into retirement."
458,officialABAT,2019-02-14 16:28:40+00:00,8.But Atiku goes in the opposite direction. He bypasses patronage to brazenly elevate the much greater evil of cronyism from the shadows to make it the central plank of his national economic policy.
459,officialABAT,2019-02-14 16:28:40+00:00,"7.Just a few weeks ago, Atiku offered his vision of the economy when he said that enriching his friends would be an appropriate objective of any government he led. At best, patronage is a regrettable and necessary reality of politics that should be severely curtailed."
460,officialABAT,2019-02-14 16:28:40+00:00,6.Former VP Atiku misappropriated his eight previous years in high office. His occupancy of high office was best characterized by low deeds. Self-enrichment occurred at lightning speed but social welfare moves slower than a dousing snail.
461,officialABAT,2019-02-14 16:28:39+00:00,"5.Since walking backwards has never appeared to me as an efficient or responsible way for a person to proceed, let alone for a nation to surmount the difficult obstacles that nations must overcome, I cannot find much good in the policies and programs announced by the PDP."
462,officialABAT,2019-02-14 16:28:39+00:00,"4.This election is more than a contest between two men, President Muhammadu Buhari and former VP Atiku Abubakar, for that one exalted chair. The election is nothing less than a historic encounter pitting one vision and version of our future against another."
463,officialABAT,2019-02-14 16:28:38+00:00,"3.The other road provides the truest, brightest chance for us to enter into our hopeful future but only if we are brave enough to believe in our capacity to improve our nation."
464,officialABAT,2019-02-14 16:28:38+00:00,https://t.co/dTOVdUt6iw road leads to a certain replay of the economic injustices of the past. It is a road well-worn with familiar pitfalls and setbacks built into the very nature of it.
465,officialABAT,2019-02-14 16:28:38+00:00,https://t.co/71ocQnWlK8 you vote on that day will determine whether we walk into the future in a manner that guides our subsequent steps toward the national greatness that calls to us or will we walk into it backwards as if feebly trying to reinvent the past.
466,officialABAT,2019-02-14 16:28:37+00:00,"A CHOICE BETWEEN PROGRESS AND RETREAT
 
The future is uncertain until we enter it. February 16 is Election Day and on that day Nigeria shall step into its future."
467,officialABAT,2019-02-13 10:09:47+00:00,"I Remain Gidigba in APC’ Despite Ogun Attack

https://t.co/xL52G69iwa"
468,officialABAT,2019-02-09 16:54:43+00:00,"2.With TSA, you know the country’s savings, you know the money in the bank, which the government is sharing on capital projects like railways and Road construction and on payment of salaries and other things. When o will you trust with your money?."
469,officialABAT,2019-02-09 16:54:42+00:00,"1.PDP came with Sure-P, Chop-P abi? What did they do with the money? They chopped the money. Now, Buhari came and introduced TSA."
470,officialABAT,2019-02-03 20:24:10+00:00,"https://t.co/sMRZO02SzZ know when Lagos sneezes, other areas catch cold. We are happy that we are able to resolve the conflict and things will start moving well going forward."""
471,officialABAT,2019-02-03 20:24:08+00:00,5.We thank the Speaker and the leadership of the House. We thank the Governor and the Deputy Governor. They have all demonstrated respect for the party leadership in Lagos.
472,officialABAT,2019-02-03 20:24:08+00:00,4.There is no impeachment. Let there be more communication and consensus-building and understanding. All these are inbuilt in the democratic system.
473,officialABAT,2019-02-03 20:24:07+00:00,"3.We examined the grievances on both sides. As leaders, we also looked into areas where there has to be compromise. In order to build institutions and encourage consensus-building, we have to do what is right."
474,officialABAT,2019-02-03 20:24:06+00:00,"2.This is of great concern to us. We looked at the source of the conflict, which is normal in a democracy, and that is why there are also conflict-resolution mechanisms."
475,officialABAT,2019-02-03 20:24:04+00:00,"1.We held a meeting on behalf of entire Lagosians. In the last one week or so, there has been some talk about a conflict between the Executive and the Legislature in Lagos."
476,officialABAT,2019-02-03 20:24:04+00:00,"Lagos APC Leaders Resolve Impeachment Crisis - Sunday 3rd February, 2019"
477,officialABAT,2019-01-29 18:10:37+00:00,"25. “Dare Atiku say what is really upsetting him and what he really is hiding in his attempt to cloak his lifetime of undemocratic reckonings in the swaddling of this much too belated democratic second birth he now claims for himself”.

Asiwaju Bola Tinubu
January 29, 2019."
478,officialABAT,2019-01-29 18:10:36+00:00,"24. “Atiku claims to be a democrat and defender of democracy, but where was he, his voice and action during Abacha’s suffocating maximum rule? Was he not a member and cheer-leader of one of the five Abacha parties aptly described then as five leprous fingers of Abacha?"
479,officialABAT,2019-01-29 18:10:36+00:00,"23. By doing so, this allows for the case to move forward without the CCT or others fearing the CJN might use his position to unduly interfere with proceedings.If the CJN is exonerated, then he will return to his position.If not exonerated, then a permanent discipline awaits him."
480,officialABAT,2019-01-29 18:10:35+00:00,"22. Nothing has been taken from the CJN that cannot be restored if the facts warrant such restoration. Thus, President Buhari conditionally suspended the CJN."
481,officialABAT,2019-01-29 18:10:35+00:00,21. “It is ironic that Atiku of all people throw such darts at President Buhari. Buhari actually exercised considerable restraint in this matter. He has reasonably balanced concerns about the integrity of the judiciary with concerns for the individual rights of the accused.
482,officialABAT,2019-01-29 18:10:35+00:00,"20. However, for Atiku to state that the CJN should remain on seat while credible and grave charges swirl around him is to put the entire workings of the Supreme Court under a heavy cloud."
483,officialABAT,2019-01-29 18:10:34+00:00,"19. Should the charges show themselves to be wrong or unproven, the CJN will be automatically reinstated as the head of the Nigerian judiciary."
484,officialABAT,2019-01-29 18:10:34+00:00,18. What he has done is to have the CJN temporarily get out of his chair so that the serious matters against him can be heard by someone other than himself.
485,officialABAT,2019-01-29 18:10:33+00:00,"17. Thus, your recourse to saying that the president violated the constitutional provision regarding the removal of a CJN is inaccurate in that Buhari never intended to remove the CJN."
486,officialABAT,2019-01-29 18:10:33+00:00,"16. If justice was your goal, you would acknowledge that the CJN has only been temporarily suspended not permanently removed."
487,officialABAT,2019-01-29 18:10:33+00:00,15. You and your advisors should know and recognize the vast legal difference between “suspension” and “removal.” Yet you persist in conflating the two in what you say is a pursuit of justice. While true you may be in pursuit of something. It is not justice.
488,officialABAT,2019-01-29 18:10:32+00:00,"14. “Strange that you would choose to depict the current situation so inaccurately as to stir emotions unduly. You claim that CJN Onnoghen has been removed. However, this is not so. He has been temporarily suspended."
489,officialABAT,2019-01-29 18:10:32+00:00,"13. Instead of repenting for rigging at least five states too many, your expressed regret was that you had not rigged enough; that you rigged one state less than the complete mauling of democracy your party and your principal had mandated."
490,officialABAT,2019-01-29 18:10:32+00:00,12. Your love for democracy is such that you were recently observed apologising to the PDP for not rigging the Lagos 2003 gubernatorial polls as you did the polls in the other Southwestern states.
491,officialABAT,2019-01-29 18:10:31+00:00,11. “You now speak of democracy and the need for executive restraint. But such verbal finery never crossed your lips or traversed your pen when you and Obasanjo improperly removed Senate Presidents.
492,officialABAT,2019-01-29 18:10:31+00:00,10. You also readily sacrificed the economic development and welfare of millions of innocent people in Lagos just to gain some illicit political advantage that proved to be fleeting and of no avail to you in the end.
493,officialABAT,2019-01-29 18:10:30+00:00,"9. Instead, you gladly and without dispute joined Obasanjo in utter disregard for these unambiguous legal verdicts. In so doing, you demeaned the rule of law."
494,officialABAT,2019-01-29 18:10:30+00:00,"8. When you lorded over Nigeria in tandem with President Obasanjo, there were myriad court orders mandating that your government render to Lagos state the funds due it to improve the lives of its millions of inhabitants."
495,officialABAT,2019-01-29 18:10:30+00:00,7. “His previous life of over seventy years was one of skirting democracy and of blatant impunity in attempting to enshrine reactionary government and installing an unjust political economy on the backs of the people
496,officialABAT,2019-01-29 18:10:29+00:00,"6. If all of his life has been dedicated to support for democracy, then he is far too young to run for president; however, I must congratulate him for having somehow managed to find or begin a second life."
497,officialABAT,2019-01-29 18:10:29+00:00,"5. In the statement, he claims to have dedicated all his life to the defense of democracy. Those of you who know him, and even those who don’t, know this is not true."
498,officialABAT,2019-01-29 18:10:28+00:00,4. Atiku thinks the piece exalts him. Instead it evinces his penchant for wilful misstatement that make him unfit for the office he now seeks and has always coveted.
499,officialABAT,2019-01-29 18:10:28+00:00,"3. I encourage everyone to read it. In its disregard for the truth and patent misrepresentations, it will go down in political history as a classic of self-incrimination."
500,officialABAT,2019-01-29 18:10:28+00:00,"2. “The PDP’s presidential candidate, former Vice President Atiku, recently made comments regarding suspension of CJN Onnoghen. Atiku’s release is entitled “State of the nation address”."
501,officialABAT,2019-01-29 18:10:27+00:00,"1. “REPLY TO ATIKU’S STATE OF THE NATION”.

https://t.co/mOw5J1t0D5"
502,officialABAT,2019-01-29 17:42:35+00:00,"20.However, for Atiku to state that the CJN should remain on seat while credible and grave charges swirl around him is to put the entire workings of the Supreme Court under a heavy cloud."
503,officialABAT,2019-01-29 17:42:34+00:00,"19.Should the charges show themselves to be wrong or unproven, the CJN will be automatically reinstated as the head of the Nigerian judiciary."
504,officialABAT,2019-01-29 17:42:34+00:00,18.What he has done is to have the CJN temporarily get out of his chair so that the serious matters against him can be heard by someone other than himself.
505,officialABAT,2019-01-29 17:42:33+00:00,"16. Thus, your recourse to saying that the president violated the constitutional provision regarding the removal of a CJN is inaccurate in that Buhari never intended to remove the CJN."
506,officialABAT,2019-01-29 17:42:33+00:00,"15. If justice was your goal, you would acknowledge that the CJN has only been temporarily suspended not permanently removed."
507,officialABAT,2019-01-29 17:42:32+00:00,"14. Strange that you would choose to depict the current situation so inaccurately as to stir emotions unduly. You claim that CJN Onnoghen has been removed. However, this is not so. He has been temporarily suspended."
508,officialABAT,2019-01-29 17:42:32+00:00,13. A few weeks ago in a televised broadcast you even revealed to the people that your official policy envisioned the base enrichment of your friends should you achieve the presidency.
509,officialABAT,2019-01-29 17:42:32+00:00,"12. Regarding such a destructive love as this, I am sure democracy and fair elections would rather do without."
510,officialABAT,2019-01-29 17:42:31+00:00,"11. Instead of repenting for rigging at least five states too many, your expressed regret was that you had not rigged enough; that you rigged one state less than the complete mauling of democracy your party and your principal had mandated."
511,officialABAT,2019-01-29 17:42:31+00:00,10. Your love for democracy is such that you were recently observed apologising to the PDP for not rigging the Lagos 2003 gubernatorial polls as you did the polls in the other Southwestern states.
512,officialABAT,2019-01-29 17:42:30+00:00,9. You also readily sacrificed the economic development and welfare of millions of innocent people in Lagos just to gain some illicit political advantage that proved to be fleeting and of no avail to you in the end.
513,officialABAT,2019-01-29 17:42:30+00:00,"8. Instead, you gladly and without dispute joined Obasanjo in utter disregard for these unambiguous legal verdicts. In so doing, you demeaned the rule of law."
514,officialABAT,2019-01-29 17:42:29+00:00,"7. When you lorded over Nigeria in tandem with President Obasanjo, there were myriad court orders mandating that your government render to Lagos state the funds due it to improve the lives of its millions of inhabitants."
515,officialABAT,2019-01-29 17:42:29+00:00,"6. In his address, he claims the nation has entered a difficult moment. To my dear and good friend Atiku, I say the difficulty is not so much with the moment but with your memory."
516,officialABAT,2019-01-29 17:42:28+00:00,5. His previous life of over seventy years was one of skirting democracy and of blatant impunity in attempting to enshrine reactionary government and installing an unjust political economy on the backs of the people.
517,officialABAT,2019-01-29 17:42:28+00:00,"4. Did he even have the courage to visit his mentor, late Major General Shehu Musa Yar Ádua, in jail for fear of Abacha stopping him from running for the governorship of Adamawa?"
518,officialABAT,2019-01-29 17:42:27+00:00,"3. “Where was he (Atiku), his voice and action during Abacha’s suffocating maximum rule? Was he not a member and cheer-leader of one of the five Abacha parties aptly described then as five leprous fingers of Abacha?"
519,officialABAT,2019-01-29 17:42:27+00:00,2. it will go down in political history as a classic of self-incrimination. Atiku thinks the piece exalts him. Instead it evinces his penchant for wilful misstatement that make him unfit for the office he now seeks and has always coveted.
520,officialABAT,2019-01-29 17:42:26+00:00,"1. “The PDP’s presidential candidate, former Vice President Atiku, recently made comments regarding suspension of CJN Onnoghen. Atiku’s release is entitled “State of the nation address”."
521,officialABAT,2019-01-23 12:05:30+00:00,"The rest are afraid of him because he has what they don’t have: character, integrity, honesty, transparency and dedication to the wellbeing of the people."
