id,User,Date,Tweet
0,officialABAT,2019-12-17 17:27:55+00:00,"10. I wish you, Mr. President, so many more years of good health and fine achievement. Happy Birthday Mr. President!"
1,officialABAT,2019-12-17 17:27:55+00:00,"9. “As usual, you have shown rare bravery and exemplary resilience in all you do. Your hand is on the plough and we know you will continue to press on. Be assured, the people of this nation are with you as you are for them."
2,officialABAT,2019-12-17 17:27:54+00:00,"8. “By expressing your desire that the party continues to be strong and vibrant even after your tenure, you have demonstrated your commitment to an enduring political legacy to buttress the patriotic legacy of your years of governance as president of our beloved republic."
3,officialABAT,2019-12-17 17:27:54+00:00,"7. As the leader of our party, you have shown great statesmanship by taking action and giving counsel that strengthens the APC and its pursuit of greater internal democracy and openness."
4,officialABAT,2019-12-17 17:27:53+00:00,6...you continue to take initiatives that draw on the immense talent and creativity of our people. “You are truly the president for this moment in our national journey. You have our full support.
5,officialABAT,2019-12-17 17:27:53+00:00,5...they will ultimately fall due to your efforts protecting our national security. Your fight against corruption has been historic and it has reflected your great personal honesty. In reviving our economy...
6,officialABAT,2019-12-17 17:27:52+00:00,"4. “A man of political courage, you have taken bold decisions that those before you knew were needed but avoided taking. You have made Nigeria safer by making the violent terrorists and wrongdoers so much weaker that..."
7,officialABAT,2019-12-17 17:27:52+00:00,"3. As president,you have done much to correct our national direction and to place us on the pathway to our better future.Your administration has been one of momentous achievement and the realization of hope and progress for our country and our party,the All Progressives Congress"
8,officialABAT,2019-12-17 17:27:51+00:00,"2. Throughout your public life you have shown yourself to be a man of hard work, dedication and principle. 

“You have exhibited that rare combination of a simple and modest lifestyle coupled with an ambitious and grand vision for our nation."
9,officialABAT,2019-12-17 17:27:51+00:00,"1. Tinubu Congratulates Buhari at 77:

Joining the rest of the country, I extend my best wishes to President Muhammadu Buhari on his birthday. This special day gives us an opportunity to personally thank you for the contributions you have made to the development of our nation."
10,officialABAT,2019-12-03 19:15:57+00:00,"25.
7. Whatever you do or wherever you are, maintain your integrity and good name. They will serve you more than riches.

Thus, today, we bid farewell to a man with such a name and who lived with such integrity. For this, he shall always be remembered."
11,officialABAT,2019-12-03 19:15:56+00:00,"24. 
5. An individual will be remembered for the impact he made in the lives of the people, for his contributions to socio-econ development.
6. There are leaders and there are leaders, but only those who make a big difference will be entitled to the positive judgment of history"
12,officialABAT,2019-12-03 19:15:56+00:00,"23. 
3. We should rededicate our lives to the agenda of progress by laying a good foundation for future generations.
4. Leaders at all levels should realise that power is neither served a la carte nor can one hold office forever."
13,officialABAT,2019-12-03 19:15:55+00:00,"22. What should the present generation learn from the deceased Lagos patriot?
1. Government must be dedicated to public welfare to earn the support of the people.
2. We should always promote the tradition of democratic inclusion."
14,officialABAT,2019-12-03 19:15:54+00:00,"21. These pioneer civil servants, particularly the four musketeers, -Act. Sect to Government A.E. Howson-Wright, Acting Financial Sect Mr. F.C.O. Coker, Legal Secretary M.I.O. Agoro and Principal Secretary J.O Adeyemi-Bero- left indelible marks in the Lagos State Civil Service."
15,officialABAT,2019-12-03 19:15:54+00:00,"20. The civil service is critical to an effective and efficient administration. Hence, the governor did not make a false start. He went out for the best technocrats who he attracted from the Federal Civil Service, Western State Civil Service and universities."
16,officialABAT,2019-12-03 19:15:53+00:00,"19. ...Justice Teslim Elias, Chief Fagbeyiro Beyioku and Chief Femi Ayantuga. Under his leadership, these elders contributed their expertise and experience, to the wellbeing and progress of Lagos State."
17,officialABAT,2019-12-03 19:15:52+00:00,"17. Not only must the government carry people along in its people-oriented activities, it must seek the benefit of a robust feedback from the very people who are the intended beneficiaries of meaningful programmes."
18,officialABAT,2019-12-03 19:15:52+00:00,"16. That approach to governance is still relevant till today, particularly under the democratic setting. A democratic government cannot be aloof. Neither can it achieve desired success through alienation of critical stakeholders."
19,officialABAT,2019-12-03 19:15:51+00:00,"15. Where others might have used a heavy hand, Pa Johnson employed tact and wisdom for governance in a challenging terrain. Governor Johnson promoted the culture of inclusiveness through his wide and painstaking consultations with eminent Lagos elders and traditional rulers."
20,officialABAT,2019-12-03 19:15:51+00:00,"14. Traditionally, military governors were deployed to fledging states to rule by force. But, the young governor was not indifferent to the consciousness, complexity and sophistication of heterogeneous Lagos."
21,officialABAT,2019-12-03 19:15:50+00:00,"13. Yet, since he did not plan to fail, he did not fail to plan. The greatest assets of a given society are its human resources. It was a credit to his administration that as its head, he made people the central focus and indeed, the cornerstone of his administration."
22,officialABAT,2019-12-03 19:15:50+00:00,"12. As a pioneer, the then youthful and promising Lieutenant-Colonel Johnson had no predecessor to emulate. As he reflected in his memoirs, he had to start with ""a clean sheet"" as there was no manual or past record of state governance to refer to."
23,officialABAT,2019-12-03 19:15:49+00:00,"11. He had embraced soldiering as a career, taking after his father, who fought in the Second World War. Little did he guess that he would be catapulted to the corridor of power. At 31, Johnson was appointed as military governor of Lagos State by Gen. Gowon on May 31, 1967."
24,officialABAT,2019-12-03 19:15:49+00:00,10. He was one of the finest officers that have worked with me and I am proud of the achievements that we together recorded for Lagos State. The youths of today have many virtues to learn from Pa Johnson.
25,officialABAT,2019-12-03 19:15:48+00:00,"9. As attested to by his Commander-in-Chief, Gen. Yakubu Gowon, Johnson’s ""courage and success in the military and later, in governance and business have been remarkable and brought him the admiration we have for him."
26,officialABAT,2019-12-03 19:15:48+00:00,"8. Brigadier-General Mobolaji Olufunso Johnson laid a durable foundation, which his successors, both military and civilians, have continued to build upon in the city-state of Lagos. His hard work, discipline and sense of purpose were legendary."
27,officialABAT,2019-12-03 19:15:47+00:00,7. He quietly offered constructive advice to successive administration in Lagos without playing to the gallery. He was a man of courage and this made him a man of peace.
28,officialABAT,2019-12-03 19:15:47+00:00,"6. In the twilight of his life, the first military governor deliberately kept a low profile. He shunned controversy, unlike some of his peers who revel in highly partisan inflammatory statements."
29,officialABAT,2019-12-03 19:15:46+00:00,"5. We recall the courage, the firmness and wisdom of decision-making, the sense of accommodation of stakeholders, the extra-ordinary emotional intelligence in power, the foresight, creativity, and the calmness of a benevolent soldier-administrator in moments of crisis."
30,officialABAT,2019-12-03 19:15:46+00:00,"4. who left good legacies in public service. We mourn no doubt. But, more importantly, we rejoice over the evergreen landmarks of the pioneer administrator who, at its formative stage, made the Centre of Excellence a reference point."
31,officialABAT,2019-12-03 19:15:45+00:00,"3. We celebrate a servant-leader, an incorruptible elder-statesman who refused to use the corridor of power as an avenue for private accumulation. We salute a gallant officer who did not compromise the ethics of military professionalism and an epitome of discipline..."
32,officialABAT,2019-12-03 19:15:44+00:00,"2. We converge to honour a man of integrity who made history as the first military administrator, and later, governor of our beloved state. We bid an officer and a gentleman farewell."
33,officialABAT,2019-12-03 19:15:44+00:00,"1. Tribute to Late Brigadier-General Mobolaji Olufunso Johnson: An Officer and Gentleman Goes Home

We gather today to pay tribute to an icon of Lagos State."
34,officialABAT,2019-11-19 15:39:26+00:00,"2. I’m deeply saddened by the death of Umar Pariya. I knew him very well. He was very cerebral. An excellent human being, Umar Pariya had a welcoming and accommodating spirit. May his soul rest in the bosom of the Lord."
35,officialABAT,2019-11-19 15:39:25+00:00,"1. My condolences to Vice President Atiku Abubakar over the loss. May VP Atiku, family, friends and associates of the late Pariya find the strength to live through this sudden and untimely demise."
36,officialABAT,2019-11-18 17:21:51+00:00,17. They have done their part; the two governors must now do theirs by providing good leadership and progressive governance to their people.
37,officialABAT,2019-11-18 17:21:51+00:00,"16. Their task is never easy.  They deserve praise for overseeing well-organised elections. Above all, I commend the people of Kogi and Bayelsa who came out to perform their civic duty and express their sovereign will in a clear and decisive manner."
38,officialABAT,2019-11-18 17:21:50+00:00,"15. Violent behaviour must not be allowed to impede our path to greatness as a democratic nation. I also commend all INEC officials involved for conducting fair, free and credible elections."
39,officialABAT,2019-11-18 17:21:50+00:00,14. We sympathise with the victims and commiserate with the families of those who lost their lives. I enjoin law-enforcement authorities to identify those responsible for perpetrating the violence and levy the full force of the law against them.
40,officialABAT,2019-11-18 17:21:49+00:00,13. I condemn the scattered incidents of violence witnessed in the election in some parts of Kogi State. Election should celebrate our democratic existence. Never should election be occasioned by loss of life.
41,officialABAT,2019-11-18 17:21:49+00:00,13. I urge the opposition candidates and politicians in Kogi and Bayelsa to rally round their governors and work together in the interests of their two states.
42,officialABAT,2019-11-18 17:21:48+00:00,"12. He must take advantage of the state’s agricultural richness as well as its proximity to the Federal Capital Territory, Abuja and the commerce resulting from that closeness."
43,officialABAT,2019-11-18 17:21:48+00:00,"11. The governor must focus on the development of the state as he is the person, more than anyone else, who will determine the fate of Kogi. He must do all he can to realise the potential of the state."
44,officialABAT,2019-11-18 17:21:47+00:00,"10. For Governor Bello, the people of Kogi have handed him a second term. Their vote is proof of the confidence that the people of Kogi retain in his leadership. He must now re-double his efforts to do even more for the people in his second term."
45,officialABAT,2019-11-18 17:21:47+00:00,9. They too must be gracious in defeat. The governor must be a leader for all and work for all Bayelsans irrespective of party affiliation.
46,officialABAT,2019-11-18 17:21:47+00:00,8. He must carry along all disparate interests in the state and be magnanimous in victory. Let him reach out to the political opponents who mounted a spirited and energetic campaign.
47,officialABAT,2019-11-18 17:21:46+00:00,7. Bayelsa is endowed with significant natural resources and human capital. It will be incumbent on the Governor-elect to harness these assets for the good of all Bayelsans.
48,officialABAT,2019-11-18 17:21:46+00:00,"6.  With this victory, Governor-elect Lyon’s task is to justify the people’s faith by providing a purposeful and transformational administration."
49,officialABAT,2019-11-18 17:21:45+00:00,"5.  By voting APC, the people of Bayelsa have voted for progressive reform and Asiwaju joins them in their belief that David Lyon is the man to deliver the needed and desired reform."
50,officialABAT,2019-11-18 17:21:45+00:00,4. It shows that the people have no appetite to return to the failed policies and practices of the past. David Lyon’s election represents a significant shift in the politics of Bayelsa State.
51,officialABAT,2019-11-18 17:21:44+00:00,"3. Their victories stand as testament to the growing acceptance of our party, the quality of our leadership and governance and the credibility of our promise to lead the people and the nation to the Next Level."
52,officialABAT,2019-11-18 17:21:44+00:00,2. The outcome of these elections shows that the people believe in the direction that President Buhari and the APC wish to take this nation. The electorate has faith in the progressive reforms our party envisions.
53,officialABAT,2019-11-15 19:42:31+00:00,10. May the soul of Chief Akinyele find eternal rest in the bosom of the Lord.
54,officialABAT,2019-11-15 19:42:30+00:00,9. My condolences also go to Governor Oluwarotimi Akeredolu and the government and people of Ondo State.
55,officialABAT,2019-11-15 19:42:30+00:00,"8. I mourn with his professional colleagues, the Public Relations practitioners and members of the Nigeria Institute of Public Relations."
56,officialABAT,2019-11-15 19:42:29+00:00,"7. My thoughts are with his family, friends and relations at this moment. May they find the strength to live through his passing."
57,officialABAT,2019-11-15 19:42:29+00:00,6. He was full of life. He was unmistakable with his sartorial elegance.The country he did his best for will sorely miss him.
58,officialABAT,2019-11-15 19:42:28+00:00,5. Chief Akinyele radiated warmth and tenderness. To meet him is to like him.
59,officialABAT,2019-11-15 19:42:28+00:00,"4. He was also one leader who was very proud of his Yoruba, indeed Ondo heritage, and demonstrated this often in his appearance and conduct."
60,officialABAT,2019-11-15 19:42:28+00:00,3. He did his best as Minister of Information and later Chairman of the Nigerian Sports Commission.
61,officialABAT,2019-11-15 19:42:27+00:00,2. Chief Alex Akinyele was an elder statesman. He served the country to the best of his abilities.
62,officialABAT,2019-11-15 19:42:27+00:00,"1. Condolence for Alex Akinyele’s Family, Professional Colleagues."
63,officialABAT,2019-11-09 21:43:25+00:00,"8. “And the Hereafter will be better for you than the first life.

And your Lord is going to give you and you will be satisfied”.

“Ma Salam.”"
64,officialABAT,2019-11-09 21:43:24+00:00,"7. We pray that Allah in His Infinite mercy continue to support you, bless your family and all the things you cherished.

For the Almighty Allah says in Qur’an 93 Verse 3-5 thus:

“Your Lord has not abandoned you nor detested you,"
65,officialABAT,2019-11-09 21:43:24+00:00,"6. As you age gracefully, we pray that Allah continue to keep you in good health and continue to grant you His blessings.

At 80, my prayer for you is as follows:"
66,officialABAT,2019-11-09 21:43:23+00:00,5. Our country is lucky to have you at this particular time. I’m highly honoured and privileged to know you because knowing you is a wonderful thing.
67,officialABAT,2019-11-09 21:43:22+00:00,"4. A man of great character, you have been a resourceful pillar of support for our president, Muhammadu Buhari. Many have rightfully described you as imbued with immense talents, your character, however, remains an inspiration to me in particular."
68,officialABAT,2019-11-09 21:43:21+00:00,"3. You are a reputable veteran journalist, successful entrepreneur, a nationalist and an Islamic faithful who has made important contributions to this country. Indeed, you have done a lot for our country."
69,officialABAT,2019-11-09 21:43:21+00:00,"2. Your life is a study in high integrity, humility and discipline. An extremely private person who hardly talks about himself, your accomplishments, however, speak highly of you."
70,officialABAT,2019-11-09 21:43:20+00:00,"1. Mamman Daura at 80
At 80, you are of sound mind, sound health, in high spirit and remain as brilliant, radiant and quick-witted as you have always been. Alihamudulilai. We are grateful to Almighty Allah for this and we pray for many more years for you."
71,officialABAT,2019-11-05 23:00:00+00:00,"21. The end result will be an economy transformed into one that provides hope, opportunity and meaningful livelihoods for all.

Indeed, we move toward a New Deal for Nigeria."
72,officialABAT,2019-11-05 23:00:00+00:00,"20.  It will do so with an eye to reforming what needs to be reformed and improving what needs to be improved. Just as the oil sector has been made better, all other sectors of the economy will be strengthened."
73,officialABAT,2019-11-05 22:59:59+00:00,"19. The amended Deep Offshore Act is not an isolated, solitary act. It is a harbinger.Just as the amended Act brings to the oil sector overdue reform that will benefit national development, the Buhari administration will take a critical look at all major segments of the economy."
74,officialABAT,2019-11-05 22:59:59+00:00,"18. ...and policy. Along with his ministers and other officials, the EAC will offer the president their best professional advice on how to improve all aspects of the economy and government’s role in it."
75,officialABAT,2019-11-05 22:59:58+00:00,"17. President Buhari is intent on reforming the economy that it may answer the needs of the majority of our people.  Establishing the Economic Council of Advisers (EAC) was an innovative, bold step, assembling our nation’s top economic minds to shape economic programmes..."
76,officialABAT,2019-11-05 22:59:58+00:00,"16. He had to grapple and make headway with these fundamental problems before shifting primary focus on economic reform. As the title of Chief of Staff Kyari’s composition indicate, we now move toward a New Deal for Nigeria."
77,officialABAT,2019-11-05 22:59:58+00:00,15. President Buhari first had to tackle insecurity and the terrorism of Boko Haram. He then had to throttle corruption in official circles so that government could be responsive to the people’s needs instead of serving those who enriched themselves from government coffers.
78,officialABAT,2019-11-05 22:59:57+00:00,14. Such beneficial reform is what the Buhari government seeks but in a more complex and challenging environment. The American challenge was exclusively economic. The Nigerian challenge is multi-faceted.
79,officialABAT,2019-11-05 22:59:57+00:00,"13. In so doing, he would reform, at times reinvent, the nation’s economic institutions and laws. This would change the relationship between the average citizen and the American government for the better. This was the essence of the New Deal."
80,officialABAT,2019-11-05 22:59:56+00:00,"12. Faced with steep economic challenges, the administration of Franklin Roosevelt dedicated itself to reforming the economy in order to bring prosperity to a hurt and struggling population."
81,officialABAT,2019-11-05 22:59:56+00:00,"11. ...principled leader to steer the nation out of danger. No two historical situations are identical. But, there are important similarities between our circumstance and the challenges America faced during that period."
82,officialABAT,2019-11-05 22:59:56+00:00,"10. The people would vote to remove the austere, insensitive party that had governed the nation for over a decade simply by catering to the wealthy. The people voted for a compassionate, progressive government headed by a committed..."
83,officialABAT,2019-11-05 22:59:55+00:00,9. Chief of Staff Kyari titled his commentary “Toward a New Deal for Nigeria.” This is appropriate and more than symbolic. The title recalls a challenging time in the history of the United States. That nation was in the throes of economic contraction.
84,officialABAT,2019-11-05 22:59:55+00:00,"8. This time, finally, the national interests were considered weightier than the special interests of a few. President Buhari and the National Assembly leadership should be commended for this singular achievement."
85,officialABAT,2019-11-05 22:59:54+00:00,7. The amendments demonstrate the important progress to be made when the National Assembly and the Presidency work in harmony for the collective good. Efforts by past governments to amend the law got bogged in failure due to the intervention of special interests.
86,officialABAT,2019-11-05 22:59:54+00:00,"6. The companies are Nigeria’s long-term business partners and we have no interest in denigrating them; all we seek is a fair, equitable relationship. The new amendments provide this."
87,officialABAT,2019-11-05 22:59:53+00:00,"5. This was no attempt to deprive the oil majors. We want the firms to make a just profit for their efforts; however, they have been receiving a surplus at the expense of our minimal developmental needs. This is not as things should be."
88,officialABAT,2019-11-05 22:59:53+00:00,4. Billions of dollars that should have landed in our national coffers to fund public infrastructure and essential social services instead found residence in the balance sheets of the oil firms.
89,officialABAT,2019-11-05 22:59:53+00:00,3. ...Presidential Chief of Staff Abba Kyari rightfully asserted the financial provisions of the old law had outlived their stated purpose. Continuation with this outmoded financial regime enriched the oil companies while depriving Nigeria of a fair bargain.
90,officialABAT,2019-11-05 22:59:52+00:00,"2. WITH the action by the National Assembly to improve the outdated Deep Offshore Act through legislative amendment, Nigeria has turned an important corner. As stated in his insightful, forward-looking commentary published in the November 1 edition of Thisday newspaper..."
91,officialABAT,2019-11-05 22:59:52+00:00,1. The coming prosperity https://t.co/I2dlSU7QXS
92,officialABAT,2019-11-01 00:55:56+00:00,12. We thank God Brigadier Johnson lived to an advanced age and left behind good children and significant legacies. May his soul Rest In Peace.
93,officialABAT,2019-11-01 00:55:56+00:00,11. My condolences also go to Governor Babajide Sanwo-Olu and the state government over the transition.
94,officialABAT,2019-11-01 00:55:55+00:00,"10. Nigeria will miss him; Lagos will miss him. We will all miss him. I commiserate with his wife, children and other family members."
95,officialABAT,2019-11-01 00:55:55+00:00,9...by the three-man panel commissioned to investigate the various allegations of corruption among the state governors who served under General Gowon.
96,officialABAT,2019-11-01 00:55:54+00:00,8. He was a man of high integrity. Johnson was one of the two state Governors (along with Brigadier-General Oluwole Rotimi) who was given a clean bill...
97,officialABAT,2019-11-01 00:55:54+00:00,7...he laid the foundation for the development of the Federal Capital Territory as the first administrator of the former Federal Territory of Lagos in 1966.
98,officialABAT,2019-11-01 00:55:54+00:00,6. Johnson made laudable contributions to the unity of the country as one of those who fought for Nigeria’s indivisibility. A committed nationalist...
99,officialABAT,2019-11-01 00:55:53+00:00,5. He was always available to advise and extend a helping hand to successive regimes in Lagos and particularly to me during my time as governor.
100,officialABAT,2019-11-01 00:55:53+00:00,"4. He contributed immensely to the state, developing the civil service. His tenure in Lagos also witnessed the building of major infrastructure in the state."
101,officialABAT,2019-11-01 00:55:52+00:00,"3. First military Governor of Lagos, Johnson embodied the true spirit of Lagos. He served Lagos with dedication and determination."
102,officialABAT,2019-11-01 00:55:52+00:00,2. Brigadier-General Mobolaji Olufunso Johnson who died on Wednesday at 83 was an important national statesman and one of the true fathers of Lagos.
103,officialABAT,2019-11-01 00:55:52+00:00,"1. Mobolaji Johnson: Nigerian Statesman, True Father of Lagos"
104,officialABAT,2019-10-30 18:01:09+00:00,"You are the backbone and best hope of our land. President Buhari and the APC shall work for your benefit and on your behalf in order to realize our common dream of a better nation.

Today we moved a step closer to that dream."
105,officialABAT,2019-10-30 18:01:08+00:00,"17. Most importantly, it is fitting to commend the people of Nigeria.  You are a law-abiding and good people. You voted in peace and good faith and you awaited the judicial process in like manner. You expect nothing from government but what it ought to do for you."
106,officialABAT,2019-10-30 18:01:08+00:00,"16. As I stated before, I know the magnanimity of President Buhari. His hand is extended to them in friendship and cooperation. For the good of the nation, I urge them to take it."
