id,User,Date,Tweet
627,officialABAT,2018-08-19 18:39:13+00:00,"6. Speaking specifically on the Sokoto governor’s defection, the APC leader said: “Governor Tambuwal’s exit can be distilled to one cause. He covets the presidency."
628,officialABAT,2018-08-19 18:38:45+00:00,"5. “Nigeria is undergoing a historic transition. Sometimes awkwardly, tentatively, yet inexorably, we nurture political and governance reform. We steadily close the door on the old malpractices that have caused a rich nation to reside in the tenement of the global poor”."
629,officialABAT,2018-08-19 18:38:17+00:00,"4. Asiwaju Tinubu asked the people to go beyond the debate on the numbers in the Senate of House of Representatives, saying “we must pull back from the shallow headlines to recognize that something fundamental is at stake."
630,officialABAT,2018-08-19 18:38:04+00:00,"3. According to him, the defectors “left the party to return to a motley agglomeration that would promise them what true democracy could not: automatic tickets, sharing of the national wealth and other offices and privileges”."
631,officialABAT,2018-08-19 18:36:49+00:00,"2. Asiwaju said on Sunday in Lagos that the defectors wanted automatic tickets and sharing of the national wealth which the APC could not guarantee.The APC leader unfolded his mind in a lengthy statement he personally signed, entitled “They Go Away Because We Go the Right Way”."
632,officialABAT,2018-08-19 18:34:34+00:00,"1. APC National Leader, Asiwaju Bola Tinubu, has opened up on the recent defections in the polity, saying Senate President Bukola Saraki and Sokoto State Governor Aminu Waziri Tambuwal among others left the APC because the party could not offer them what they wanted."
633,officialABAT,2018-08-19 18:34:21+00:00,"Saraki, Tambuwal Left APC Because They Wanted Automatic Tickets, Says Tinubu +Text of Speech"
634,officialABAT,2018-06-24 19:54:50+00:00,"11.Buhari has done significant work clearing yesterday’s mess so that we may reach a better future.When his critics grossly falsify by saying he hasn't achieved enough,remember what the old woman told me“Your broom is good but it takes more than a stroke to clean a dirty house.”"
635,officialABAT,2018-06-24 19:52:55+00:00,"10.When the PDP holds their convention and presents their candidates, the public should ask them.  If the question is asked, theirs will be the quietest convention ever held. They dare not answer the question with honesty for an honest answer will destroy them."
636,officialABAT,2018-06-24 19:51:15+00:00,"9. The APC was not brought into existence to compel the majority to serve the few. For 16 consecutive years, the PDP had already assumed that mean role.

The APC came into being to reverse this unjust equation."
637,officialABAT,2018-06-24 19:50:50+00:00,8. The APC’s formation is the most important political development in our recent history. This is not due to the names of those who founded the party. It is because of the ideals upon which the party was established.
638,officialABAT,2018-06-24 19:50:22+00:00,"7. While they planned a lifetime of greedy enrichment by looting the people’s resources and the public treasury for 60 years, we moved to reform the economy to bring development and aid to the poor."
639,officialABAT,2018-06-24 19:49:53+00:00,"6. With their schemes foiled, those who tried to destroy us must bear witness to the destruction of their edifice of corrupt governance and their dreams of unjust domination of our nation."
640,officialABAT,2018-06-24 19:49:23+00:00,"5. Lacking the courage to face the democratic will of the people, they tried to misuse the courts as a weapon against democracy. We thank the judiciary for following the letter and spirit of the constitution by dismissing this dirty dozen of malicious cases filed against us."
641,officialABAT,2018-06-24 19:49:02+00:00,"4. There were twelve cases brought trying to stop us from merging, from registering the new party, then attempting to bar our candidate from the election."
642,officialABAT,2018-06-24 19:48:40+00:00,"3. They wanted to see the end of us and our pursuit of good governance for Nigeria. You should not forget, as I shall never forget, the strong efforts they made to stop us in the courts."
643,officialABAT,2018-06-24 19:48:08+00:00,"2. Joined in goodwill by common purpose and noble endeavor, we assemble this day. The doubters who gave APC no chance of existence or of continued survival have gotten their reply in full. Their envious prayers and complaints have been answered in reverse."
644,officialABAT,2018-06-24 19:23:33+00:00,"1. Speech delivered by Asiwaju Bola Ahmed Tinubu at the APC National Convention 2018 held at Eagle Square Abuja on Saturday, June 23rd, 2018."
645,officialABAT,2018-05-05 16:24:52+00:00,2. We have had leadership discussions. I like the fact that they showed up respectfully and are all committed to the peace and stability of the party in that state.
646,officialABAT,2018-05-05 16:24:26+00:00,1.On Ekiti State APC Primaries: I have put my own political gear in neutral. I have no anointed candidate. Everyone there aspiring and contesting are very dear members and they deserve the right to participate. About 33 of them in all and we only need one of them for governorship
647,officialABAT,2018-04-25 16:46:42+00:00,"Anthony Joshua MBE. The Unified Heavy Weight Boxing Champion of the  World, IBO, WBA, IBF, WBO handsigned glove delivered to Asiwaju Bola  Tinubu by Khomeini Bukhari, Director of Africa, Peel Aston Global. https://t.co/k8WfCu7zrm"
648,officialABAT,2018-04-17 16:14:18+00:00,"10.""Without such adherence, a party becomes a vehicle to lord over its members instead of a tool to empower its members to realize good and beneficial aims. We must always remember that the political party is meant to serve the people and not the people to serve the party."""
649,officialABAT,2018-04-17 16:12:21+00:00,"9.""The APC has been working to steer our national ship from this awful direction in order that we may bring the people and their welfare into safe harbor."""
650,officialABAT,2018-04-17 16:12:07+00:00,"8.""Consequently, the Buhari government has spent inordinate time cleaning the rot and plugging the holes in the corrupt system the others had institutionalised as their strategic policy and national direction."""
651,officialABAT,2018-04-17 16:11:41+00:00,"7.""The APC government may, at times be, imperfect in fulfilling the spirit of Aminu Kano but we are far from the PDP, which has perfected the malign craft of giving selfish ambition primacy over the public good."""
652,officialABAT,2018-04-17 16:10:43+00:00,"6.“Without such adherence, a party becomes a vehicle to lord over its members instead of a tool to empower its members to realize good and beneficial aims. We must always remember that the political party is meant to serve the people and not the people to serve the party”."
653,officialABAT,2018-04-17 16:10:31+00:00,"5.Recent events in the APC had confirmed that “party discipline is vital but even more vital is adherence to humane and democratic ideals and principles. With such principles, a party exercises internal democracy, which better enables it to govern democratically."
654,officialABAT,2018-04-17 16:08:38+00:00,"4.""They will arrogate power so that they come to dictate to the rest of the party instead of serving the collective will of party members”."
655,officialABAT,2018-04-17 16:08:19+00:00,"3.""Calling for party supremacy by and for its own sake is nothing but an invitation for people to install and then perpetuate themselves in positions of authority in the party."""
656,officialABAT,2018-04-17 16:07:49+00:00,"2. Asiwaju Tinubu said on the topic of the conference that “With regard to Party Ideology and Supremacy, let me state that ideology and principle must hold supremacy over supremacy. I think Mallam Aminu Kano would have said the same thing in this regard."""
657,officialABAT,2018-04-17 16:06:13+00:00,"1.Asiwaju at the Aminu Kano Memorial, Warns against Party Executives Perpetuating Themselves in Office. Tues 17th April in Kano as Special Guest of Honour at the 35th memorial of the late Mallam Aminu Kano organised by Aminu Kano Centre for Democratic Research, Mambaya House."
658,officialABAT,2018-03-30 13:58:54+00:00,"10th Bola Tinubu Colloquium 
Investing in People 
29th March, 2018 https://t.co/hHMld4slk9"
659,officialABAT,2018-03-30 13:27:25+00:00,14. We must articulate a programme and promise Nigerians once again that we have the audacity of hope to put Nigeria on the path of prosperity and banish poverty in the country.
660,officialABAT,2018-03-30 13:26:44+00:00,13. I will submit a proposal on how we can stimulate the economy. We don’t have to pay for a house of N10 million in one day and with cash; we need mortgage. This would discourage corruption.
661,officialABAT,2018-03-30 13:26:11+00:00,12. We have a nation to rescue; we have a good leader to emulate and we have hope. We have reduced the propensity for corruption. We must strengthen the pension plank to stimulate growth.
662,officialABAT,2018-03-30 13:24:40+00:00,"11. Don’t take their apologies; they lied, they falsified, they changed figures, they made fake promises and they say we shouldn’t talk about them."
663,officialABAT,2018-03-30 13:23:40+00:00,"10. On our part, we have good leaders to salvage the situation and we have hope that we can do it. We must put all that is necessary in place, to stimulate the economy."
664,officialABAT,2018-03-30 13:23:29+00:00,"9. For 16 years they looted the country and they say we shouldn’t talk about it, as if we should just go ahead and run our government..."
665,officialABAT,2018-03-30 13:22:30+00:00,"8. My grandmother used to ask me to write letters to her. Somebody is writing letters now, letter of politics these days. As if they have not been there before. Bad belle letters!"
666,officialABAT,2018-03-30 13:22:20+00:00,7. Thank you Nigerians for being patient with us! But there is a clear understanding here; that the difference between us and them is like day and night...
667,officialABAT,2018-03-30 13:21:42+00:00,"6. So, we would report back to Nigerians about what we found on ground. We did not say that there would be no challenges, because even America is facing challenges. They have wasted our resources."
668,officialABAT,2018-03-30 13:21:32+00:00,5. I can see what the government is doing with the little resources at its disposal. This has been demonstrated in practical terms. What’s the lesson to all Nigerians: forget those parties; they won’t come back. We did not envisage that there would be so much challenges.
669,officialABAT,2018-03-30 13:20:55+00:00,"4. Life is nothing without challenges. Our logo is broom bound together. This symbolizes a united Nigeria against terrorism, corruption and revival of the economy."
670,officialABAT,2018-03-30 13:20:43+00:00,"3. We have faced challenges in the last three years. We came in with a lot of hope and enthusiasm as APC leaders. We gave our people hope; we believed in Nigeria and in ourselves, thinking we can change Nigeria for good and we are still going to do it."
671,officialABAT,2018-03-30 13:19:56+00:00,"2. I have a prepared speech, but I am not going to dwell on that. Life is not without challenges. Our logo is broom, we come together, you have a Nigeria focusing against terrorism, against corruption and to promote economic revival of the country."
672,officialABAT,2018-03-30 13:19:30+00:00,"1. Protocol...We have to put our heads together, believing in ourselves that we are going to do it.  We can give our people the best through the competent hands that we have."
673,officialABAT,2018-03-30 13:18:22+00:00,"The 10th Bola Tinubu Colloquium: Investing in People.

Excerpts of Asiwaju's speech at the event:"
674,officialABAT,2018-02-16 21:57:26+00:00,"(2) We can't go back to re-invent the wheel. Let's move on and see how we can use the experience of the past to shape the future. As advisory council to my committee, let us continue to communicate in our search for a way forward."
675,officialABAT,2018-02-16 21:56:21+00:00,"Asiwaju at APC NWC Meeting: Quotes -

(1) We should all know that the APC platform is bigger than us. It will outlive President Buhari. It will also outlive me. Buhari will not be the only president this party will produce. So let all of us work hard to strengthen the party."
676,officialABAT,2018-01-18 18:53:23+00:00,"11. In short, to resolve this lethal problem, government must implement a multi-dimensional policy that encompasses security, agro-economic, educational and emergency relief elements. This is the art and mastery of governance that our nation and its complex problems require."
677,officialABAT,2018-01-18 18:52:59+00:00,"10. Additionally, government should establish a relief and rehabilitation program for those families and communities that have been so grievously harmed."
678,officialABAT,2018-01-18 18:52:25+00:00,"9. Thus, herders have no right to cling to this way of life by killing others. Government must stop their violence but also offer them a viable new way of life by moving them toward more modern, non-nomadic cattle rearing."
679,officialABAT,2018-01-18 18:51:01+00:00,8. The crux of the matter is that the nomadic way of life is fast becoming obsolete. Large scale nomadic practice does not belong in this day and age. This is reality and it is inescapable.
680,officialABAT,2018-01-18 18:50:26+00:00,"7. As we commend these security measures, we must not lose sight of the fact that the problem bears an economic origin. Thus, agro-economic policy initiatives must help shape the lasting solution."
681,officialABAT,2018-01-18 18:50:06+00:00,6. I welcome the deployment of more law enforcement and military into the troubled areas. These security measures will stem the immediate violence and loss of life.
682,officialABAT,2018-01-18 18:49:12+00:00,5. It is incumbent on the federal government to do what past governments neglected to do. We must forget our age-old prejudices in order to resolve herders/farmers' problem. What we need is serious committed action.
683,officialABAT,2018-01-18 18:48:37+00:00,...Social services must become a reality close at hand and not a vague dream lying in the distance.
684,officialABAT,2018-01-18 18:48:15+00:00,"4. I believe we must transform the nation by embarking on deep and impactful reforms, by creating more jobs, providing social policy initiatives and building an infrastructure befitting a leading nation..."
685,officialABAT,2018-01-18 18:46:28+00:00,"3. Thus, it is imperative that we not allow politics as usual to claim the 2019 election season away from us.

We must insist on the principle that elections do not return to being games played by a well-heeled elite while the rest of the nation is left to struggle and starve."
686,officialABAT,2018-01-18 18:45:36+00:00,"2.  Elections are not the climax of an epic book. They are merely the close of the book’s opening chapter.

What comes afterwards – governance -- is much more vital than politics, for governance determines how we shall live."
687,officialABAT,2018-01-18 18:44:54+00:00,"...The objective of a game is served by the mere playing of it. Playing the game is an end in and of itself. However, this cannot be the case with politics and elections."
688,officialABAT,2018-01-18 18:44:39+00:00,"Asiwaju Tinubu at 15th Trust Annual Dialogue

1. While democratic politics inherently bear aspects of competition and contest, it must never be reduced to a mere game."
689,officialABAT,2018-01-16 08:34:45+00:00,"Happy birthday to Chief Bisi Akande. Ex-governor,  former APC Interim Chairman, indefatigable leader and dependable ally. Baba, igba odun, odun kan ni o. Amin."
690,officialABAT,2017-12-13 21:57:31+00:00,"11.Asiwaju firmly asserted in a public statement on Dec 17th 2014 endorsing Osinbajo for the position of running mate to Buhari “After all the political calculations are made and the dust of competition has settled,it must be this nation and its people who stand first &amp; foremost"""
691,officialABAT,2017-12-13 21:52:02+00:00,"10.When it turned out that such an offer would not be in the interest of the party and would play into the hands of enemies of change, Asiwaju unreservedly and passionately threw his support behind Osinbajo as the best man for the job."
692,officialABAT,2017-12-13 21:51:46+00:00,"9.When at some point in the build up to the 2015 election, President Buhari offered him the Vice –Presidential ticket, Tinubu gratefully and publicly thanked the President."
693,officialABAT,2017-12-13 21:50:07+00:00,8.Asiwaju takes serious exception to the insinuation by the Sun and in some other quarters that there was ever any so-called frosty relationship between Buhari and Tinubu. We challenge the Sun to provide any evidence where Tinubu has ever complained of any grouse against Buhari.
694,officialABAT,2017-12-13 21:49:18+00:00,"7.Asiwaju Tinubu will never support any attempt to distract Buhari and Osinbajo from the job they are passionately doing through the kind of false report carried by the Sun. In particular, this story does great injustice to Vice President Osinbajo."
695,officialABAT,2017-12-13 21:48:22+00:00,6.The hemorrhaging of the national economy through the wanton and unprecedented corruption that obtained before the advent of the APC Federal Government has been stanched.
696,officialABAT,2017-12-13 21:48:12+00:00,"5.For the avoidance of doubt, Asiwaju Tinubu has absolute confidence and faith in both President Buhari and Vice President Osinbajo who have been working hard harmoniously in offering inspirational leadership to Nigeria at a most critical period in her history."
697,officialABAT,2017-12-13 21:46:45+00:00,"4...instigate crisis within the party, stoke dangerous embers of religious disaffection within the party and the country generally and stem the remarkable progress being made in the reinvention and revitalization of Nigeria."
698,officialABAT,2017-12-13 21:46:24+00:00,"3.This is clearly an attempt to distract the APC Federal Govt from the yeoman’s job it has been doing in rescuing the country from the deep rooted socio-economic, political, security and moral mess inherited from the PDP’s 16 years misrule of Nigeria,.."
699,officialABAT,2017-12-13 21:44:14+00:00,"2.Is it even conceivable, as the story recklessly insinuates, that Vice President Yemi Osinbajo would be considering returning to full church work rather than run with his boss, President Buhari for a second term if the latter so decides."
700,officialABAT,2017-12-13 21:40:42+00:00,"1.The SUN newspaper of yesterday, Dec 13, 2017, which sensationally and ridiculously reported that President Muhammadu Buhari may pick Asiwaju Tinubu as his running mate for the 2019 election. This is a classic case of utterly and irredeemably fake news."
701,officialABAT,2017-11-22 18:03:18+00:00,6. -Asiwaju Tinubu responding to a question on alleged automatic ticket for President Buhari. He spoke with journalists after a meeting with Pa Fasoranti in Akure.
702,officialABAT,2017-11-22 18:02:39+00:00,"5. ""Buhari has not excluded anybody, and he has not stopped anybody from aspiring or contesting"""
703,officialABAT,2017-11-22 18:01:54+00:00,"4. ""But if the national body, the NEC, and all of us as party members and we endorse him as our single candidate, we will not be violating INEC regulations, we will not be violating our party’s constitution. What you are hearing is just a campaign."
704,officialABAT,2017-11-22 18:00:50+00:00,"4. ""But if the national body, the NEC, and all of us as party members and we endorse him as our single candidate, we will not be violating INEC regulations, we will not be violating our party’s constitution. What you are hearing is just a campaign."""
705,officialABAT,2017-11-22 18:00:04+00:00,"3. ""We follow constitutional provisions and an individual opinion does not matter at this stage. Buhari will want a normal process, Buhari that I know. Who says he will lose at any convention?"""
706,officialABAT,2017-11-22 17:59:20+00:00,"2. ""We wanted him even before the last convention and primaries of the party. Akeredolu is here standing with me, he was not the governor then. He was one of the leading delegates that voted properly and Buhari was a clear winner."""
707,officialABAT,2017-11-22 17:58:35+00:00,"""I have not heard about that and the APC Spokesman has not said that. No governor can appropriate the power of endorsement to himself. President Buhari is a believer in process, the Buhari I know believes in rule of law and due process."""
708,officialABAT,2017-11-17 11:19:33+00:00,"13. “Unlike its predecessor, this government has demonstrated the will to walk this path. While this might not cause much fanfare or celebration, this cleanses the institutions upon which a nation’s wellbeing is founded with a future assured,”"
709,officialABAT,2017-11-17 11:15:50+00:00,"12. “One minister and her rogues’ gallery picked the pocket of this nation for billions of dollars.While poor at governance, these people could give a master thief lessons in the sleight of hand.In governance, they earned a red card but in the corruption,they won the gold medal."""
710,officialABAT,2017-11-17 11:10:45+00:00,"11. ""“So much money grew feet and ran away faster than Usain Bolt ever could. That which could have been spent on national development was squandered in ways that would cause the devil to blush."""
711,officialABAT,2017-11-17 11:09:04+00:00,"10. “Had the previous government remained in place, Boko Haram would have surely eaten more territory and devoured more people. This nation might have indeed been divided and cut asunder, not by choice but by the knife of terrorism,”"
712,officialABAT,2017-11-17 11:07:27+00:00,"9. ""We also must move toward true federalism by the balance of power and responsibility bet­ween the federal government and the stat­es. In so doing, we attain the correct balance between our collective purpose on one hand and our separate grassroots realities on the other."""
713,officialABAT,2017-11-17 11:05:12+00:00,"8. “Today, as I stand before you all, I implore him and his government. The good you have started…. do it the more. The good that you have yet to achieve …. get to it with a laser- like focus."""
714,officialABAT,2017-11-17 11:04:46+00:00,"7. “If I were an architect, I would say that President Buhari has used the last two years to wisely lay the deep and wide foundation for a new building called a better Nigeria."""
715,officialABAT,2017-11-17 11:01:45+00:00,"6. “Too many parents cannot properly feed and clothe their precious children, too many young adults exist in the void of joblessness, and too many of us do not have the resources to care for elderly parents who once cared for them. We must cure these wrongs."
716,officialABAT,2017-11-17 10:57:40+00:00,"5. The government’s attention on three key ideas – the establishment of a robust industrial capacity, the need for a national infrastructural plan and the need to help common farmers by improving rural output and incomes."
717,officialABAT,2017-11-17 10:52:22+00:00,"4. “As this government implements its economic plans, the griping poverty you have long suffered will give way and ultimately turn into the fertile progress and prosperity that only good governance can bring. We do this with a sense of urgency!”"
718,officialABAT,2017-11-17 10:51:44+00:00,"3. “Where prosperity should have stood, poverty was erected. Where progress should have been established, stagnation assumed residence.  We are trying hard to escape this deep hole."""
719,officialABAT,2017-11-17 10:47:49+00:00,"2. “What I proffer today is done in the spirit of utmost respect and affinity by one who wants the best for this government and for Nigeria. I say these things to encourage the government to achieve the greatness the times demand and of which this government is capable"""
720,officialABAT,2017-11-17 10:46:51+00:00,"1. Keynote speaker at the presentation of a book “Making steady, Sustainable Progress for Nigeria’s Peace and Prosperity: A Mid-term Scorecard on the Muhammadu Buhari Administration”"
721,officialABAT,2017-11-03 15:07:45+00:00,"18. Please continue to pray for him wherever you are.

This is Jide Tinubu: https://t.co/NFY9mTlMEK"
722,officialABAT,2017-11-03 15:03:39+00:00,"17. Again, as we are away from Lagos, we thank you for the love you have shown and ask that you not only show it to us but to each other."
723,officialABAT,2017-11-03 15:02:40+00:00,"16. Let us all take a lesson from this and think a bit more about our fellow man, our neighbor, our fellow Nigeria."
724,officialABAT,2017-11-03 15:02:00+00:00,"15. However, what I can do is to be more caring and helpful to the living as I know this is what Jide would want to become of his passing."
725,officialABAT,2017-11-03 15:01:48+00:00,14. I wish I could bring my son back but I cannot.
726,officialABAT,2017-11-03 15:00:46+00:00,"13. This says so much about the innate goodness in all of us. For no matter what, we are not foes or enemies. We are all of one human stock,"
727,officialABAT,2017-11-03 14:59:08+00:00,12. Even those who don’t agree with me politically have shown strong support and care indistinguishable from that of my associates.
728,officialABAT,2017-11-03 14:58:37+00:00,"11. People of every tribe, region, faith and every political affiliation have expressed their sympathy and extended to me brotherly embrace."
729,officialABAT,2017-11-03 14:55:54+00:00,10. Your reaction to my son’s passing has taught me that we can be a people of profound love and humanity when we want to be.
